{
  "version": 1,
  "task": "Identify one high-impact hotspot file for refactor in HarborPilot, prioritize high coupling and duplicated orchestration logic, and return focused files for minimal-risk modular extraction.",
  "generated_at": "2026-02-10T21:21:40.652701+00:00",
  "budget": {
    "max_chars": 24000,
    "max_snippets": 60,
    "top_n_files": 12
  },
  "top_files": [
    {
      "path": "src/backend/scripts/loop-director.py",
      "score": 0.847619,
      "reasons": [
        "symbol_match",
        "reference_proximity",
        "dependency_impact",
        "test_relevance"
      ],
      "signals": [
        {
          "signal_name": "symbol_match",
          "score": 1.0
        },
        {
          "signal_name": "reference_proximity",
          "score": 1.0
        },
        {
          "signal_name": "dependency_impact",
          "score": 0.238095
        },
        {
          "signal_name": "test_relevance",
          "score": 1.0
        },
        {
          "signal_name": "changed_boost",
          "score": 0.0
        }
      ]
    },
    {
      "path": "src/backend/app/routers/llm.py",
      "score": 0.838095,
      "reasons": [
        "symbol_match",
        "reference_proximity",
        "dependency_impact",
        "test_relevance"
      ],
      "signals": [
        {
          "signal_name": "symbol_match",
          "score": 1.0
        },
        {
          "signal_name": "reference_proximity",
          "score": 1.0
        },
        {
          "signal_name": "dependency_impact",
          "score": 0.190476
        },
        {
          "signal_name": "test_relevance",
          "score": 1.0
        },
        {
          "signal_name": "changed_boost",
          "score": 0.0
        }
      ]
    },
    {
      "path": "src/backend/app/llm/providers/codex_cli_provider.py",
      "score": 0.828571,
      "reasons": [
        "symbol_match",
        "reference_proximity",
        "dependency_impact",
        "test_relevance"
      ],
      "signals": [
        {
          "signal_name": "symbol_match",
          "score": 1.0
        },
        {
          "signal_name": "reference_proximity",
          "score": 1.0
        },
        {
          "signal_name": "dependency_impact",
          "score": 0.142857
        },
        {
          "signal_name": "test_relevance",
          "score": 1.0
        },
        {
          "signal_name": "changed_boost",
          "score": 0.0
        }
      ]
    },
    {
      "path": "src/backend/app/services/interactive_interview_streaming.py",
      "score": 0.821429,
      "reasons": [
        "symbol_match",
        "reference_proximity",
        "dependency_impact",
        "test_relevance"
      ],
      "signals": [
        {
          "signal_name": "symbol_match",
          "score": 0.952381
        },
        {
          "signal_name": "reference_proximity",
          "score": 1.0
        },
        {
          "signal_name": "dependency_impact",
          "score": 0.190476
        },
        {
          "signal_name": "test_relevance",
          "score": 1.0
        },
        {
          "signal_name": "changed_boost",
          "score": 0.0
        }
      ]
    },
    {
      "path": "tests/e2e/utils/file_utils.py",
      "score": 0.819048,
      "reasons": [
        "symbol_match",
        "reference_proximity",
        "dependency_impact",
        "test_relevance"
      ],
      "signals": [
        {
          "signal_name": "symbol_match",
          "score": 1.0
        },
        {
          "signal_name": "reference_proximity",
          "score": 1.0
        },
        {
          "signal_name": "dependency_impact",
          "score": 0.095238
        },
        {
          "signal_name": "test_relevance",
          "score": 1.0
        },
        {
          "signal_name": "changed_boost",
          "score": 0.0
        }
      ]
    },
    {
      "path": "src/backend/app/llm/providers/gemini_api_provider.py",
      "score": 0.809524,
      "reasons": [
        "symbol_match",
        "reference_proximity",
        "dependency_impact",
        "test_relevance"
      ],
      "signals": [
        {
          "signal_name": "symbol_match",
          "score": 1.0
        },
        {
          "signal_name": "reference_proximity",
          "score": 1.0
        },
        {
          "signal_name": "dependency_impact",
          "score": 0.047619
        },
        {
          "signal_name": "test_relevance",
          "score": 1.0
        },
        {
          "signal_name": "changed_boost",
          "score": 0.0
        }
      ]
    },
    {
      "path": "src/backend/app/llm/providers/gemini_cli_provider.py",
      "score": 0.809524,
      "reasons": [
        "symbol_match",
        "reference_proximity",
        "dependency_impact",
        "test_relevance"
      ],
      "signals": [
        {
          "signal_name": "symbol_match",
          "score": 1.0
        },
        {
          "signal_name": "reference_proximity",
          "score": 1.0
        },
        {
          "signal_name": "dependency_impact",
          "score": 0.047619
        },
        {
          "signal_name": "test_relevance",
          "score": 1.0
        },
        {
          "signal_name": "changed_boost",
          "score": 0.0
        }
      ]
    },
    {
      "path": "src/backend/app/utils.py",
      "score": 0.809524,
      "reasons": [
        "symbol_match",
        "reference_proximity",
        "dependency_impact",
        "test_relevance"
      ],
      "signals": [
        {
          "signal_name": "symbol_match",
          "score": 1.0
        },
        {
          "signal_name": "reference_proximity",
          "score": 1.0
        },
        {
          "signal_name": "dependency_impact",
          "score": 0.047619
        },
        {
          "signal_name": "test_relevance",
          "score": 1.0
        },
        {
          "signal_name": "changed_boost",
          "score": 0.0
        }
      ]
    },
    {
      "path": "src/backend/core/harborpilot_loop/context_engine.py",
      "score": 0.809524,
      "reasons": [
        "symbol_match",
        "reference_proximity",
        "dependency_impact",
        "test_relevance"
      ],
      "signals": [
        {
          "signal_name": "symbol_match",
          "score": 1.0
        },
        {
          "signal_name": "reference_proximity",
          "score": 1.0
        },
        {
          "signal_name": "dependency_impact",
          "score": 0.047619
        },
        {
          "signal_name": "test_relevance",
          "score": 1.0
        },
        {
          "signal_name": "changed_boost",
          "score": 0.0
        }
      ]
    },
    {
      "path": "src/backend/scripts/loop-pm.py",
      "score": 0.778571,
      "reasons": [
        "symbol_match",
        "reference_proximity",
        "dependency_impact",
        "test_relevance"
      ],
      "signals": [
        {
          "signal_name": "symbol_match",
          "score": 0.857143
        },
        {
          "signal_name": "reference_proximity",
          "score": 1.0
        },
        {
          "signal_name": "dependency_impact",
          "score": 0.142857
        },
        {
          "signal_name": "test_relevance",
          "score": 1.0
        },
        {
          "signal_name": "changed_boost",
          "score": 0.0
        }
      ]
    },
    {
      "path": "src/backend/app/llm/providers/minimax_provider.py",
      "score": 0.77619,
      "reasons": [
        "symbol_match",
        "reference_proximity",
        "dependency_impact",
        "test_relevance"
      ],
      "signals": [
        {
          "signal_name": "symbol_match",
          "score": 0.904762
        },
        {
          "signal_name": "reference_proximity",
          "score": 1.0
        },
        {
          "signal_name": "dependency_impact",
          "score": 0.047619
        },
        {
          "signal_name": "test_relevance",
          "score": 1.0
        },
        {
          "signal_name": "changed_boost",
          "score": 0.0
        }
      ]
    },
    {
      "path": "src/backend/app/services/llm_tests/utils.py",
      "score": 0.702381,
      "reasons": [
        "symbol_match",
        "reference_proximity",
        "dependency_impact",
        "test_relevance"
      ],
      "signals": [
        {
          "signal_name": "symbol_match",
          "score": 0.666667
        },
        {
          "signal_name": "reference_proximity",
          "score": 1.0
        },
        {
          "signal_name": "dependency_impact",
          "score": 0.095238
        },
        {
          "signal_name": "test_relevance",
          "score": 1.0
        },
        {
          "signal_name": "changed_boost",
          "score": 0.0
        }
      ]
    }
  ],
  "snippets": [
    {
      "path": "src/backend/scripts/loop-director.py",
      "start_line": 1,
      "end_line": 51,
      "symbol": "enforce_utf8",
      "reason": "symbol_or_token_focus",